<solicituddistribucion xmlns:xsi="http://www.w3.org/2001/XMLSchema-instance" xsi:noNamespaceSchemaLocation="zaraSchema.xsd">

	<numero>1000</numero>

	<tienda>
		<codigoTienda>1</codigoTienda>
		<nombreTienda>Florida</nombreTienda>
	</tienda>

	<articulosropa>
		<articuloropa>
			<codigo>1000</codigo>
			<cantidad>50</cantidad>
		</articuloropa>
		<articuloropa>
			<codigo>1001</codigo>
			<cantidad>20</cantidad>
		</articuloropa>

	</articulosropa>
</solicituddistribucion>